<channels
    xmlns:xsi="http://www.w3.org/2001/XMLSchema-instance"
    xsi:noNamespaceSchemaLocation="https://raw.githubusercontent.com/roman-corgi/ctc-dip/refs/heads/main/schema/categorization.xsd">
  <cal_a/>
  <cal_absflux/>
  <cal_badpixelmap>
    <operand keyword="VISTYPE" operator="equals-any">
      <value>-999</value>
      <value>N/A</value>
    </operand>
    <operand keyword="FRMTYPE" not="true" operator="equals-all">
      <value>ACQ</value>
    </operand>
    <operator>and</operator>
  </cal_badpixelmap>
  <cal_boresight>
    <operand keyword="VISTYPE" operator="equals-all">
      <value>CGIVST_CAL_BORESIGHT</value>
    </operand>
    <operand keyword="FRMTYPE" not="true" operator="equals-all">
      <value>ACQ</value>
    </operand>
    <operator>and</operator>
  </cal_boresight>
  <cal_corethpt>
    <operand keyword="VISTYPE" operator="equals-all">
      <value>CGIVST_CAL_CORETHRPT</value>
    </operand>
    <operand keyword="FRMTYPE" not="true" operator="equals-all">
      <value>ACQ</value>
    </operand>
    <operator>and</operator>
  </cal_corethpt>
  <cal_darkpc>
    <operand keyword="VISTYPE" operator="equals-all">
      <value>CGIVST_CAL_DRK</value>
    </operand>
    <operand keyword="FRMTYPE" not="true" operator="equals-all">
      <value>ACQ</value>
    </operand>
    <operator>and</operator>
    <operand keyword="PC_STAT" operator="equals-all">
      <value>photon-counted master dark</value>
    </operand>
    <operator>and</operator>
    <operand keyword="IS_SYNTH" operator="equals-all">
      <value>0</value>
    </operand>
    <operator>and</operator>
  </cal_darkpc>
  <cal_darksynth>
    <operand keyword="VISTYPE" operator="equals-all">
      <value>CGIVST_CAL_DRK</value>
    </operand>
    <operand keyword="FRMTYPE" not="true" operator="equals-all">
      <value>ACQ</value>
    </operand>
    <operator>and</operator>
    <operand keyword="PC_STAT" operator="equals-all">
      <value>analog master dark</value>
    </operand>
    <operator>and</operator>
    <operand keyword="IS_SYNTH" operator="equals-all">
      <value>1</value>
    </operand>
    <operator>and</operator>
  </cal_darksynth>
  <cal_darktrad>
    <operand keyword="VISTYPE" operator="equals-all">
      <value>CGIVST_CAL_DRK</value>
    </operand>
    <operand keyword="FRMTYPE" not="true" operator="equals-all">
      <value>ACQ</value>
    </operand>
    <operator>and</operator>
    <operand keyword="PC_STAT" operator="equals-all">
      <value>analog master dark</value>
    </operand>
    <operator>and</operator>
    <operand keyword="IS_SYNTH" operator="equals-all">
      <value>0</value>
    </operand>
    <operator>and</operator>
  </cal_darktrad>
  <cal_dispersionmodel>
     <operand keyword="VISTYPE" operator="equals-any">
      <value>CGIVST_CAL_SPEC_TGTREF</value>
    </operand>
    <operand keyword="FRMTYPE" not="true" operator="equals-all">
      <value>ACQ</value>
    </operand>
    <operator>and</operator>
    <operand keyword="FPAMNAME" operator="equals-any">
      <value>OPEN</value>
    </operand>
    <operator>and</operator>
  </cal_dispersionmodel>
  <cal_flatfield>
    <operand keyword="VISTYPE" operator="equals-any">
      <value>CGIVST_CAL_FLAT</value>
    </operand>
    <operand keyword="DPAMNAME" operator="equals-any" not="true">
      <value>POL0</value>
      <value>POL45</value>
    </operand>
    <operator>and</operator>
  </cal_flatfield>
  <cal_polff>
    <operand keyword="VISTYPE" operator="equals-any">
      <value>CGIVST_CAL_FLAT</value>
    </operand>
    <operand keyword="DPAMNAME" operator="equals-any">
      <value>POL0</value>
      <value>POL45</value>
    </operand>
    <operator>and</operator>
  </cal_polff>
  <cal_linespread/>
  <cal_muellermatrix/>
  <cal_ndfiltimg/>
  <cal_ndfiltspec/>
  <cal_pupil>
    <operand keyword="VISTYPE" operator="equals-all">
      <value>CGIVST_CAL_PUPIL_IMAGING</value>
    </operand>
    <operand keyword="FRMTYPE" not="true" operator="equals-all">
      <value>ACQ</value>
    </operand>
    <operator>and</operator>
  </cal_pupil>
  <cal_wlzeropoint/>
  <eng_a>
    <operand keyword="VISTYPE" operator="equals-any">
      <value>CGIVST_ENG_OTA_WVFRNT</value>
      <value>CGIVST_ENG_PFAC</value>
      <value>CGIVST_ENG_PUPILCAL</value>
      <value>CGIVST_ENG_IMAGECAL</value>
      <value>CGIVST_ENG_GENERIC_RASTER</value>
      <value>CGIVST_TDD_SETUP_HOWFSC</value>
      <value>CGIVST_TDD_OBS_HOWFSC</value>
      <value>CGIVST_UTI_GENERIC_STAR</value>
      <value>CGIVST_UTI_POINT_REFINE</value>
    </operand>
    <operand keyword="DPAMNAME" operator="contains-any">
      <value>IMAGING</value>
      <value>PUPIL</value>
      <value>DEFOCUS1</value>
      <value>DEFOCUS2</value>
      <value>DEFOCUS3</value>
      <value>DEFOCUS4</value>
    </operand>
    <operand keyword="FRMTYPE" not="true" operator="equals-any">
      <value>ACQ</value>
      <value>SPBAL-FPAM</value>
      <value>SPBAL-FSAM</value>
      <value>GITL</value>
    </operand>
    <operator>and</operator>
    <operator>and</operator>
  </eng_a>
  <nfov_a>
    <operand keyword="VISTYPE" operator="equals-any">
      <value>CGIVST_TDD_OBS</value>
    </operand>
    <operand keyword="DPAMNAME" operator="contains-any">
      <value>IMAGING</value>
    </operand>
    <operator>and</operator>
    <operand keyword="ISPC" operator="contains-any">
      <value>0</value>
    </operand>
    <operator>and</operator>
    <operand keyword="SPAMNAME" operator="contains-any">
      <value>OPEN</value>
    </operand>
    <operator>and</operator>
    <operand keyword="FRMTYPE" not="true" operator="equals-any">
      <value>ACQ</value>
      <value>SPBAL-FPAM</value>
      <value>SPBAL-FSAM</value>
    </operand>
    <operator>and</operator>
    <operand keyword="FRMTYPE" operator="contains-any">
      <value>CONT</value>
      <value>NUM</value>
    </operand>
    <operator>and</operator>
  </nfov_a>
  <nfov_nc>
    <operand keyword="VISTYPE" operator="equals-any">
      <value>CGIVST_CAL_TGTREF_PHOT</value>
    </operand>
    <operand keyword="DPAMNAME" operator="contains-any">
      <value>IMAGING</value>
    </operand>
    <operator>and</operator>
    <operand keyword="ISPC" operator="contains-any">
      <value>0</value>
    </operand>
   <operand keyword="SPAMNAME" operator="contains-any">
      <value>OPEN</value>
    </operand>
    <operator>and</operator>
    <operator>and</operator>
    <operand keyword="FRMTYPE" not="true" operator="equals-any">
      <value>ACQ</value>
      <value>SPBAL-FPAM</value>
      <value>SPBAL-FSAM</value>
    </operand>
    <operator>and</operator>
    <operand keyword="FRMTYPE" not="true" operator="contains-any">
      <value>CONT</value>
      <value>NUM</value>
    </operand>
    <operator>and</operator>
  </nfov_nc>
  <nfov_pc>
    <operand keyword="VISTYPE" operator="equals-any">
      <value>CGIVST_TDD_OBS</value>
    </operand>
    <operand keyword="DPAMNAME" operator="contains-any">
      <value>IMAGING</value>
    </operand>
    <operator>and</operator>
    <operand keyword="ISPC" operator="contains-any">
      <value>1</value>
    </operand>
    <operator>and</operator>
    <operand keyword="SPAMNAME" operator="contains-any">
      <value>OPEN</value>
    </operand>
    <operator>and</operator>
    <operand keyword="FRMTYPE" not="true" operator="equals-any">
      <value>ACQ</value>
      <value>SPBAL-FPAM</value>
      <value>SPBAL-FSAM</value>
    </operand>
    <operator>and</operator>
    <operand keyword="FRMTYPE" operator="contains-any">
      <value>CONT</value>
      <value>NUM</value>
    </operand>
    <operator>and</operator>
  </nfov_pc>
  <pol_a>
    <operand keyword="VISTYPE" operator="equals-any">
      <value>CGIVST_TDD_POL_OB</value>
    </operand>
    <operand keyword="DPAMNAME" operator="contains-any">
      <value>POL0</value>
      <value>POL45</value>
    </operand>
    <operand keyword="ISPC" operator="contains-any">
      <value>0</value>
    </operand>
    <operand keyword="FRMTYPE" not="true" operator="equals-any">
      <value>ACQ</value>
      <value>SPBAL-FPAM</value>
      <value>SPBAL-FSAM</value>
    </operand>
    <operand keyword="FRMTYPE" operator="contains-any">
      <value>CONT</value>
      <value>NUM</value>
    </operand>
    <operator>and</operator>
    <operator>and</operator>
    <operator>and</operator>
    <operator>and</operator>
  </pol_a>
  <pol_pc>
    <operand keyword="VISTYPE" operator="equals-any">
      <value>CGIVST_TDD_POL_OB</value>
    </operand>
    <operand keyword="DPAMNAME" operator="contains-any">
      <value>POL0</value>
      <value>POL45</value>
    </operand>
    <operand keyword="ISPC" operator="contains-any">
      <value>1</value>
    </operand>
    <operand keyword="FRMTYPE" not="true" operator="equals-any">
      <value>ACQ</value>
      <value>SPBAL-FPAM</value>
      <value>SPBAL-FSAM</value>
    </operand>
    <operand keyword="FRMTYPE" operator="contains-any">
      <value>CONT</value>
      <value>NUM</value>
    </operand>
    <operator>and</operator>
    <operator>and</operator>
    <operator>and</operator>
    <operator>and</operator>
  </pol_pc>
  <spec_a>
    <operand keyword="VISTYPE" operator="equals-any">
      <value>CGIVST_TDD_OBS</value>
    </operand>
    <operand keyword="DPAMNAME" operator="contains-any">
      <value>PRISM2</value>
      <value>PRISM3</value>
    </operand>
    <operand keyword="ISPC" operator="contains-any">
      <value>0</value>
    </operand>
    <operand keyword="FRMTYPE" not="true" operator="equals-any">
      <value>ACQ</value>
      <value>SPBAL-FPAM</value>
      <value>SPBAL-FSAM</value>
    </operand>
    <operand keyword="FRMTYPE" operator="contains-any">
      <value>CONT</value>
      <value>NUM</value>
    </operand>
    <operator>and</operator>
    <operator>and</operator>
    <operator>and</operator>
    <operator>and</operator>
  </spec_a>
  <spec_nc>
    <operand keyword="VISTYPE" operator="equals-any">